[
  {
    "name": "Centipede Swarm",
    "cr": 4,
    "size": "Diminutive",
    "type": "Vermin",
    "subtype": "Swarm",
    "hit_dice": "9d8+6",
    "hp_avg": 46,
    "initiative": 4,
    "speed": {"land": 20, "climb": 20},
    "armor_class": {"total": 18, "touch": 18, "flat_footed": 14, "components": "+4 size, +4 Dex"},
    "base_attack": 6,
    "grapple": -17,
    "attacks": [
      {"name": "Swarm", "attack_bonus": "+10 melee", "damage": "2d6 plus poison", "damage_type": "Piercing"}
    ],
    "special_attacks": ["Distraction (Fort DC 14 or nauseated 1 round)", "Poison (Fort DC 14; 1d4 Dex / 1d4 Dex)"],
    "special_qualities": ["Darkvision 60 ft.", "Immune to Weapon Damage", "Swarm Traits", "Tremorsense 30 ft.", "Vermin Traits"],
    "saves": {"fort": 5, "ref": 7, "will": 3},
    "abilities": {"str": 1, "dex": 19, "con": 8, "int": null, "wis": 10, "cha": 2},
    "skills": {"Climb": 12, "Listen": 4, "Spot": 4},
    "feats": [],
    "alignment": "Always N",
    "advancement": null,
    "dr": null,
    "sr": null,
    "regen": null,
    "fast_heal": null,
    "elemental_weaknesses": [],
    "alignment_weaknesses": [],
    "passive_effects": [],
    "population_base": 1,
    "allowed_biomes": ["Temperate_Forest", "Warm_Forest", "Underground", "Any_Ruin"],
    "primary_biome": "Underground",
    "ecology_notes": "Centipede swarms consist of thousands of tiny poisonous centipedes moving as a single mass. They overwhelm prey through sheer numbers, injecting venom with countless simultaneous bites."
  },
  {
    "name": "Hellwasp Swarm",
    "cr": 8,
    "size": "Diminutive",
    "type": "Outsider",
    "subtype": "Evil, Extraplanar, Swarm",
    "hit_dice": "12d8+27",
    "hp_avg": 81,
    "initiative": 4,
    "speed": {"land": 5, "fly": 40},
    "armor_class": {"total": 18, "touch": 18, "flat_footed": 14, "components": "+4 size, +4 Dex"},
    "base_attack": 12,
    "grapple": -17,
    "attacks": [
      {"name": "Swarm", "attack_bonus": "+16 melee", "damage": "3d6 plus poison", "damage_type": "Piercing"}
    ],
    "special_attacks": [
      "Distraction (Fort DC 18 or nauseated 1 round)",
      "Inhabit (grapple check vs. Large or smaller creature; swarm enters body and controls it)",
      "Poison (Fort DC 18; 1d6 Dex / 1d6 Dex)"
    ],
    "special_qualities": ["Darkvision 60 ft.", "DR 10/magic", "Immune to Weapon Damage", "SR 20", "Swarm Traits"],
    "saves": {"fort": 11, "ref": 12, "will": 9},
    "abilities": {"str": 1, "dex": 18, "con": 14, "int": 6, "wis": 13, "cha": 9},
    "skills": {"Hide": 16, "Listen": 12, "Search": 4, "Sense Motive": 12, "Spot": 12},
    "feats": [],
    "alignment": "Always LE",
    "advancement": null,
    "dr": "10/magic",
    "sr": 20,
    "regen": null,
    "fast_heal": null,
    "elemental_weaknesses": [],
    "alignment_weaknesses": [],
    "passive_effects": [],
    "population_base": 1,
    "allowed_biomes": ["Underground", "Any_Ruin", "Warm_Forest"],
    "primary_biome": "Underground",
    "ecology_notes": "Hellwasp swarms are infernal insects from the Lower Planes. They are terrifyingly intelligent and can inhabit the bodies of living creatures, controlling them like puppets from within."
  },
  {
    "name": "Locust Swarm",
    "cr": 3,
    "size": "Diminutive",
    "type": "Vermin",
    "subtype": "Swarm",
    "hit_dice": "6d8+6",
    "hp_avg": 33,
    "initiative": 4,
    "speed": {"land": 10, "fly": 30},
    "armor_class": {"total": 18, "touch": 18, "flat_footed": 14, "components": "+4 size, +4 Dex"},
    "base_attack": 4,
    "grapple": -17,
    "attacks": [
      {"name": "Swarm", "attack_bonus": "+8 melee", "damage": "1d6", "damage_type": "Piercing"}
    ],
    "special_attacks": ["Distraction (Fort DC 13 or nauseated 1 round)"],
    "special_qualities": ["Darkvision 60 ft.", "Immune to Weapon Damage", "Swarm Traits", "Vermin Traits"],
    "saves": {"fort": 5, "ref": 6, "will": 2},
    "abilities": {"str": 1, "dex": 18, "con": 12, "int": null, "wis": 10, "cha": 9},
    "skills": {"Listen": 4, "Spot": 4},
    "feats": [],
    "alignment": "Always N",
    "advancement": null,
    "dr": null,
    "sr": null,
    "regen": null,
    "fast_heal": null,
    "elemental_weaknesses": [],
    "alignment_weaknesses": [],
    "passive_effects": [],
    "population_base": 1,
    "allowed_biomes": ["Warm_Plain", "Warm_Desert", "Temperate_Plain", "Warm_Forest"],
    "primary_biome": "Warm_Plain",
    "ecology_notes": "Locust swarms are vast clouds of devouring insects that can strip fields and forests bare in hours. They overwhelm creatures caught in their path through sheer biting mass."
  },
  {
    "name": "Rat Swarm",
    "cr": 2,
    "size": "Tiny",
    "type": "Animal",
    "subtype": "Swarm",
    "hit_dice": "4d8",
    "hp_avg": 18,
    "initiative": 2,
    "speed": {"land": 15, "climb": 15, "swim": 15},
    "armor_class": {"total": 14, "touch": 14, "flat_footed": 12, "components": "+2 size, +2 Dex"},
    "base_attack": 3,
    "grapple": -11,
    "attacks": [
      {"name": "Swarm", "attack_bonus": "+5 melee", "damage": "1d6", "damage_type": "Piercing"}
    ],
    "special_attacks": [
      "Distraction (Fort DC 12 or nauseated 1 round)",
      "Disease (Filth Fever; Fort DC 12; incubation 1d3 days; 1d3 Dex / 1d3 Con)"
    ],
    "special_qualities": ["Half damage from slashing/piercing", "Low-Light Vision", "Scent", "Swarm Traits"],
    "saves": {"fort": 4, "ref": 6, "will": 2},
    "abilities": {"str": 2, "dex": 15, "con": 10, "int": 2, "wis": 12, "cha": 2},
    "skills": {"Balance": 10, "Climb": 10, "Hide": 14, "Listen": 6, "Spot": 7, "Swim": 10},
    "feats": [],
    "alignment": "Always N",
    "advancement": null,
    "dr": null,
    "sr": null,
    "regen": null,
    "fast_heal": null,
    "elemental_weaknesses": [],
    "alignment_weaknesses": [],
    "passive_effects": [],
    "population_base": 1,
    "allowed_biomes": ["Any_Urban", "Underground", "Temperate_Forest", "Any_Ruin"],
    "primary_biome": "Any_Urban",
    "ecology_notes": "Rat swarms erupt from sewers and granaries when their population explodes. They overwhelm much larger creatures and spread disease, making them a serious hazard in urban and dungeon environments."
  },
  {
    "name": "Spider Swarm",
    "cr": 1,
    "size": "Diminutive",
    "type": "Vermin",
    "subtype": "Swarm",
    "hit_dice": "2d8",
    "hp_avg": 9,
    "initiative": 3,
    "speed": {"land": 20, "climb": 20},
    "armor_class": {"total": 17, "touch": 17, "flat_footed": 14, "components": "+4 size, +3 Dex"},
    "base_attack": 1,
    "grapple": -15,
    "attacks": [
      {"name": "Swarm", "attack_bonus": "+5 melee", "damage": "1d6 plus poison", "damage_type": "Piercing"}
    ],
    "special_attacks": ["Distraction (Fort DC 11 or nauseated 1 round)", "Poison (Fort DC 11; 1d3 Str / 1d3 Str)"],
    "special_qualities": ["Darkvision 60 ft.", "Immune to Weapon Damage", "Swarm Traits", "Tremorsense 30 ft.", "Vermin Traits"],
    "saves": {"fort": 3, "ref": 3, "will": 0},
    "abilities": {"str": 1, "dex": 17, "con": 10, "int": null, "wis": 10, "cha": 2},
    "skills": {"Climb": 11, "Listen": 4, "Spot": 4},
    "feats": [],
    "alignment": "Always N",
    "advancement": null,
    "dr": null,
    "sr": null,
    "regen": null,
    "fast_heal": null,
    "elemental_weaknesses": [],
    "alignment_weaknesses": [],
    "passive_effects": [],
    "population_base": 1,
    "allowed_biomes": ["Temperate_Forest", "Warm_Forest", "Underground", "Any_Ruin"],
    "primary_biome": "Underground",
    "ecology_notes": "Spider swarms are masses of thousands of tiny spiders that surge across floors, walls, and ceilings. Their collective poison and distraction make them dangerous despite individual spider harmlessness."
  }
]
